{
  "snapshot_id": "snap_salon001",
  "created_at": "2026-01-16T09:30:00Z",
  "rulebase_version": "v1.0.0",
  "variables": [
    {
      "name": "domain",
      "value": "salon",
      "confirmed": true,
      "source": "user"
    },
    {
      "name": "monthly_orders",
      "value": 180,
      "confirmed": true,
      "source": "user"
    },
    {
      "name": "has_online_storefront",
      "value": true,
      "confirmed": true,
      "source": "user"
    },
    {
      "name": "primary_goal",
      "value": "reduce_no_shows",
      "confirmed": true,
      "source": "user"
    },
    {
      "name": "budget_tier",
      "value": "medium",
      "confirmed": true,
      "source": "deterministic-validation"
    }
  ]
}
